{
  "aggregate": {
    "case_count": 15,
    "controller_polls": 14,
    "executive_submissions": 12,
    "expected_boundary_outcome_accuracy": 1.0,
    "expected_fail_closed_case_count": 7,
    "fail_closed_expectation_accuracy": 1.0,
    "failed_case_count": 0,
    "intent_frames_validated": 15,
    "interrupts_requested": 2,
    "logical_ticks": 13,
    "matched_fail_closed_case_count": 7,
    "passed_case_count": 15,
    "physical_navigation_episode_count": 0,
    "physical_navigation_success_rate": null,
    "plan_contracts_parsed": 16,
    "plans_admitted": 12,
    "plans_rejected": 4,
    "reports_accepted": 14,
    "runtime_callbacks": 12,
    "semantic_dispatches": 12,
    "stale_reports_ignored": 1,
    "typed_results": 15,
    "verified_facts_accepted": 9,
    "verified_facts_emitted": 10
  },
  "cases": [
    {
      "actual": {
        "admission": "accepted",
        "callbacks": [
          {
            "kind": "navigate",
            "value": "walk to the sidewalk"
          }
        ],
        "dispatch_skills": [
          "NavigateTo"
        ],
        "no_dispatch": false,
        "report_actions": [
          "progress_recorded",
          "task_succeeded"
        ],
        "task_state": "succeeded",
        "validation_code": null,
        "verified_facts": [
          "inside"
        ]
      },
      "case_id": "sidewalk_inside_boundary",
      "expected": {
        "admission": "accepted",
        "callbacks": [
          {
            "kind": "navigate",
            "value": "walk to the sidewalk"
          }
        ],
        "dispatch_skills": [
          "NavigateTo"
        ],
        "no_dispatch": false,
        "report_actions": [
          "progress_recorded",
          "task_succeeded"
        ],
        "task_state": "succeeded",
        "verified_facts": [
          "inside"
        ]
      },
      "failures": [],
      "metrics": {
        "controller_polls": 2,
        "executive_submissions": 1,
        "intent_frames_validated": 1,
        "interrupts_requested": 0,
        "logical_ticks": 1,
        "plan_contracts_parsed": 1,
        "plans_admitted": 1,
        "plans_rejected": 0,
        "reports_accepted": 2,
        "runtime_callbacks": 1,
        "semantic_dispatches": 1,
        "stale_reports_ignored": 0,
        "typed_results": 2,
        "verified_facts_accepted": 1,
        "verified_facts_emitted": 1
      },
      "passed": true,
      "scenario": "pipeline"
    },
    {
      "actual": {
        "admission": "accepted",
        "callbacks": [
          {
            "kind": "navigate",
            "value": "wait by the lamppost"
          }
        ],
        "dispatch_skills": [
          "NavigateTo"
        ],
        "no_dispatch": false,
        "report_actions": [
          "progress_recorded",
          "task_succeeded"
        ],
        "task_state": "succeeded",
        "validation_code": null,
        "verified_facts": [
          "near"
        ]
      },
      "case_id": "lamppost_near_boundary",
      "expected": {
        "admission": "accepted",
        "callbacks": [
          {
            "kind": "navigate",
            "value": "wait by the lamppost"
          }
        ],
        "dispatch_skills": [
          "NavigateTo"
        ],
        "no_dispatch": false,
        "report_actions": [
          "progress_recorded",
          "task_succeeded"
        ],
        "task_state": "succeeded",
        "verified_facts": [
          "near"
        ]
      },
      "failures": [],
      "metrics": {
        "controller_polls": 2,
        "executive_submissions": 1,
        "intent_frames_validated": 1,
        "interrupts_requested": 0,
        "logical_ticks": 1,
        "plan_contracts_parsed": 1,
        "plans_admitted": 1,
        "plans_rejected": 0,
        "reports_accepted": 2,
        "runtime_callbacks": 1,
        "semantic_dispatches": 1,
        "stale_reports_ignored": 0,
        "typed_results": 2,
        "verified_facts_accepted": 1,
        "verified_facts_emitted": 1
      },
      "passed": true,
      "scenario": "pipeline"
    },
    {
      "actual": {
        "admission": "accepted",
        "callbacks": [
          {
            "kind": "spatial_behavior",
            "value": {
              "behavior": "orbit_owner",
              "direction": "clockwise",
              "revolutions": 1.0,
              "size": "small",
              "steps": 0
            }
          }
        ],
        "dispatch_skills": [
          "OrbitOwner"
        ],
        "no_dispatch": false,
        "report_actions": [
          "task_succeeded"
        ],
        "task_state": "succeeded",
        "validation_code": null,
        "verified_facts": [
          "orbit_complete"
        ]
      },
      "case_id": "owner_orbit_one_boundary",
      "expected": {
        "admission": "accepted",
        "callbacks": [
          {
            "kind": "spatial_behavior",
            "value": {
              "behavior": "orbit_owner",
              "direction": "clockwise",
              "revolutions": 1.0,
              "size": "small",
              "steps": 0
            }
          }
        ],
        "dispatch_skills": [
          "OrbitOwner"
        ],
        "no_dispatch": false,
        "report_actions": [
          "task_succeeded"
        ],
        "task_state": "succeeded",
        "verified_facts": [
          "orbit_complete"
        ]
      },
      "failures": [],
      "metrics": {
        "controller_polls": 1,
        "executive_submissions": 1,
        "intent_frames_validated": 1,
        "interrupts_requested": 0,
        "logical_ticks": 1,
        "plan_contracts_parsed": 1,
        "plans_admitted": 1,
        "plans_rejected": 0,
        "reports_accepted": 1,
        "runtime_callbacks": 1,
        "semantic_dispatches": 1,
        "stale_reports_ignored": 0,
        "typed_results": 1,
        "verified_facts_accepted": 1,
        "verified_facts_emitted": 1
      },
      "passed": true,
      "scenario": "pipeline"
    },
    {
      "actual": {
        "admission": "accepted",
        "callbacks": [
          {
            "kind": "spatial_behavior",
            "value": {
              "behavior": "move_steps",
              "direction": "away_from_owner",
              "revolutions": 1.0,
              "size": "normal",
              "steps": 5
            }
          }
        ],
        "dispatch_skills": [
          "MoveRelative"
        ],
        "no_dispatch": false,
        "report_actions": [
          "task_succeeded"
        ],
        "task_state": "succeeded",
        "validation_code": null,
        "verified_facts": [
          "distance_travelled"
        ]
      },
      "case_id": "five_steps_away_boundary",
      "expected": {
        "admission": "accepted",
        "callbacks": [
          {
            "kind": "spatial_behavior",
            "value": {
              "behavior": "move_steps",
              "direction": "away_from_owner",
              "revolutions": 1.0,
              "size": "normal",
              "steps": 5
            }
          }
        ],
        "dispatch_skills": [
          "MoveRelative"
        ],
        "no_dispatch": false,
        "report_actions": [
          "task_succeeded"
        ],
        "task_state": "succeeded",
        "verified_facts": [
          "distance_travelled"
        ]
      },
      "failures": [],
      "metrics": {
        "controller_polls": 1,
        "executive_submissions": 1,
        "intent_frames_validated": 1,
        "interrupts_requested": 0,
        "logical_ticks": 1,
        "plan_contracts_parsed": 1,
        "plans_admitted": 1,
        "plans_rejected": 0,
        "reports_accepted": 1,
        "runtime_callbacks": 1,
        "semantic_dispatches": 1,
        "stale_reports_ignored": 0,
        "typed_results": 1,
        "verified_facts_accepted": 1,
        "verified_facts_emitted": 1
      },
      "passed": true,
      "scenario": "pipeline"
    },
    {
      "actual": {
        "admission": "accepted",
        "callbacks": [
          {
            "kind": "follow_formation",
            "value": {
              "distance_m": 1.8,
              "relation": "behind"
            }
          }
        ],
        "dispatch_skills": [
          "FollowFormation"
        ],
        "no_dispatch": false,
        "report_actions": [
          "progress_recorded",
          "task_succeeded"
        ],
        "task_state": "succeeded",
        "validation_code": null,
        "verified_facts": [
          "behind"
        ]
      },
      "case_id": "behind_follow_boundary",
      "expected": {
        "admission": "accepted",
        "callbacks": [
          {
            "kind": "follow_formation",
            "value": {
              "distance_m": 1.8,
              "relation": "behind"
            }
          }
        ],
        "dispatch_skills": [
          "FollowFormation"
        ],
        "no_dispatch": false,
        "report_actions": [
          "progress_recorded",
          "task_succeeded"
        ],
        "task_state": "succeeded",
        "verified_facts": [
          "behind"
        ]
      },
      "failures": [],
      "metrics": {
        "controller_polls": 2,
        "executive_submissions": 1,
        "intent_frames_validated": 1,
        "interrupts_requested": 0,
        "logical_ticks": 1,
        "plan_contracts_parsed": 1,
        "plans_admitted": 1,
        "plans_rejected": 0,
        "reports_accepted": 2,
        "runtime_callbacks": 1,
        "semantic_dispatches": 1,
        "stale_reports_ignored": 0,
        "typed_results": 2,
        "verified_facts_accepted": 1,
        "verified_facts_emitted": 1
      },
      "passed": true,
      "scenario": "pipeline"
    },
    {
      "actual": {
        "admission": "accepted",
        "callbacks": [
          {
            "kind": "vocalize",
            "value": "I'm ready and holding here."
          },